{
  "v": 1,
  "kind": "x07.web_ui.frame",
  "state": { "count": 0 },
  "ui": {
    "v": 1,
    "kind": "x07.web_ui.tree",
    "root": {
      "k": "el",
      "tag": "div",
      "key": "root",
      "props": { "attrs": {}, "class": ["app"], "style": {} },
      "on": [],
      "children": [
        { "k": "text", "key": "t1", "text": "Hello" }
      ]
    }
  },
  "patches": [
    { "op": "replace", "path": "/root/children/0/text", "value": "Hello" }
  ],
  "effects": [],
  "telemetry": {}
}

